{
  "checker": {
    "lean_compile_status": "pending-toolchain",
    "lean_declaration": "CSTTT.Countermodels.cm07_noCanonicalGlobalNow",
    "lean_source_status": "explicit-proof-source-present",
    "python_checker": "cst_tt.countermodels:CM-07",
    "python_status": "passed"
  },
  "claim_ceiling": "structural-boundary-only",
  "claim_lanes": [
    "S-T"
  ],
  "conclusion_failure_status": "certified",
  "countermodel_id": "CM-07",
  "finite_model_ref": "models/countermodels/CM-07.model.json",
  "finite_model_sha256": "a48b2362e1e0d8b7f952dfcb885b1d668b8506ec7d1d4c8c4fd51edd0fd3bc40",
  "minimality_status": "certified",
  "model_family": "clock-translation-loop",
  "name": "Nonzero clock-translation holonomy",
  "premises_status": "certified",
  "result_status": "checked-finite-countermodel",
  "schema_version": "CST-TT-01",
  "scope": "A nonzero cycle translation obstructs one route-independent global now.",
  "search": {
    "algorithm": "deterministic-exhaustive-enumeration",
    "bound": "one or two nodes; cyclic clocks of modulus 1..4; all loop translations",
    "candidates_explored": 20,
    "lower_bound_argument": "Modulus one has no nonzero translation; one node with a modulus-two loop is the smallest obstruction.",
    "minimality_result": "proved-by-exhaustive-bounded-search",
    "ordering": "lexicographic(size_vector, canonical_json(model))",
    "qualifying_candidates": 12,
    "same_size_candidates_explored": 2,
    "same_size_qualifying_candidates": 1,
    "size_measure": "(node_count, clock_modulus)",
    "smaller_candidates_explored": 1,
    "witness_size_vector": [
      1,
      2
    ]
  },
  "target_no_go_id": "TTN-05",
  "toy_model_ref": "TTM-05"
}
